{
  "schemaVersion": 1,
  "name": "my-course",
  "course": {
    "courseId": "my-course",
    "title": "My LessonKit Course",
    "layout": "single-spa",
    "lessons": [{ "id": "lesson-1", "title": "My first lesson" }],
    "assessments": [
      {
        "checkId": "ready-to-build",
        "question": "Ready to build?",
        "choices": ["Not yet", "Yes"],
        "answer": "Yes",
        "passingScore": 1
      }
    ],
    "theme": { "preset": "default" }
  },
  "paths": {
    "spaDistDir": "dist",
    "lxpackOutDir": ".lxpack/course",
    "outputBaseDir": ".lxpack/out"
  }
}
