{
  "schemaVersion": 1,
  "name": "slide-deck",
  "course": {
    "courseId": "slide-deck-demo",
    "title": "Slide Deck (1.3.0)",
    "layout": "single-spa",
    "spaLessonId": "deck-lesson",
    "lessons": [{ "id": "deck-lesson", "title": "Onboarding presentation" }],
    "assessments": [
      {
        "kind": "trueFalse",
        "checkId": "ppe-deck-tf",
        "question": "PPE is optional in the warehouse.",
        "answer": false,
        "passingScore": 1
      }
    ],
    "theme": { "preset": "default" },
    "tracking": { "completion": { "threshold": 1 } }
  },
  "paths": {
    "spaDistDir": "dist",
    "lxpackOutDir": ".lxpack/course",
    "outputBaseDir": ".lxpack/out"
  }
}
