{
  "schemaVersion": 1,
  "name": "studio-minimal",
  "course": {
    "courseId": "studio-minimal",
    "title": "Studio minimal preview",
    "layout": "single-spa",
    "spaLessonId": "lesson-1",
    "lessons": [{ "id": "lesson-1", "title": "Getting started" }],
    "assessments": [
      {
        "checkId": "ready-check",
        "question": "Is the shared renderer working?",
        "choices": ["Not yet", "Yes"],
        "answer": "Yes",
        "passingScore": 1
      }
    ],
    "theme": { "preset": "default" }
  },
  "paths": {
    "spaDistDir": "dist",
    "lxpackOutDir": ".lxpack/course",
    "outputBaseDir": ".lxpack/out"
  }
}
